298	314	2	If you do not wish to enter the hut, continue your mission by	Si vous ne souhaitez pas entrer dans la cabane, continuer votre mission en	ne pas y entrer et poursuivre	29	ne pas entrer dans la cabane et continuer la mission	oui
300	315	3	If you wish to go left,	Si vous souhaitez aller à gauche,	aller à gauche	14	aller à gauche	
301	315	3	If you wish to go right,	Si vous souhaitez aller à droite,	aller à droite	14	aller à droite	
302	316	2	You may evade combat at any time by diving into the River Xane.	Vous pouvez échapper à un combat à tout moment en plongeant dans la rivière Xane.	(ATM) plonger dans la rivière Xane	34	(à tout moment) fuir le combat en plongeant dans la rivière Xane	
304	320	2	If you wish to search them,	Si vous souhaitez les rechercher,	les fouiller	12	les fouiller	
305	320	2	If you wish to question them,	Si vous souhaitez les interroger,	les interroger	14	les interroger	
306	322	2	If you wish to take the west tunnel,	Si vous souhaitez prendre le tunnel ouest,	prendre le tunnel ouest	23	prendre le tunnel ouest	
307	322	2	If you wish to take the south tunnel,	Si vous souhaitez prendre le tunnel sud,	prendre le tunnel sud	21	prendre le tunnel sud	
308	324	2	If you wish to use the front door,	Si vous souhaitez utiliser la porte d'entrée,	passer par la porte	19	passer par la porte	
309	324	2	If you wish to jump from the first-floor window,	Si vous souhaitez sauter de la fenêtre du premier étage,	sauter du balcon du premier étage	33	sauter du balcon du premier étage	
310	330	3	If you wish to search the wrecked wagon,	Si vous souhaitez rechercher le wagon naufragé,	fouiller les débris du chariot	30	fouiller les débris du chariot	
311	330	3	If you wish to ignore the wagon and press on along the highway,	Si vous souhaitez ignorer le chariot et appuyez sur le long de la route,	l'ignorer et poursuivre sur la route	36	ignorer le chariot et poursuivre sur la route	
312	330	3	If you wish to investigate the track that leads up into the hills,	Si vous souhaitez enquêter sur la piste qui mène dans les collines,	explorer le sentier menant aux collines	39	explorer le sentier qui mène dans les collines	
314	331	2	If you do not have this skill, you can search for an exit from the chamber and	Si vous ne possédez pas cette compétence, vous pouvez rechercher une sortie de la chambre et	chercher une issue à la salle	29	chercher une issue à la salle	